{
  "id": "observe-code",
  "name": "Observe â†’ Code",
  "tagline": "Facilitator & Builder",
  "description": "One agent validates and guides through testing. Another builds features through phased, test-driven development. Mock UI first, then real implementation.",
  "version": "1.0.0",
  "icon": "scan",
  "active": false,
  "roles": [
    {
      "id": "observer",
      "name": "Observer",
      "role": "orchestrator",
      "description": "Validates work, runs tests, ensures quality, provides feedback. Does NOT write code.",
      "promptFile": "observer.md",
      "capabilities": {
        "canResolveImpediments": true
      }
    },
    {
      "id": "coder",
      "name": "Coder",
      "role": "implementer",
      "description": "Implements features through phased development. Builds tests, writes code, follows feedback.",
      "promptFile": "coder.md",
      "capabilities": {
        "canResolveImpediments": false
      }
    }
  ],
  "phases": [
    "validating",
    "implementing",
    "reviewing"
  ],
  "flow": [
    "Ensure PRD exists (create if needed)",
    "Observer checks tool availability",
    "Coder implements phase (mock-first)",
    "Observer validates (tests + UI)",
    "Observer provides feedback",
    "Repeat until feature complete"
  ],
  "humanRole": "Create/approve PRD, authenticate for testing, resolve major blockers",
  "bestFor": [
    "Features requiring thorough testing",
    "UI-heavy implementations",
    "Test-driven development",
    "Progressive implementation"
  ]
}
