{
  "id": "investigate-fix",
  "name": "Investigate â†’ Fix",
  "tagline": "Detective & Fixer",
  "description": "One agent hunts down the root cause. Another surgically fixes it.",
  "version": "1.0.0",
  "icon": "bug",
  "active": false,
  "roles": [
    {
      "id": "detective",
      "name": "Detective",
      "role": "orchestrator",
      "description": "Reproduces issues, traces through code, identifies root cause",
      "promptFile": "detective.md",
      "capabilities": {
        "canResolveImpediments": true
      }
    },
    {
      "id": "surgeon",
      "name": "Surgeon",
      "role": "implementer",
      "description": "Applies targeted fixes, adds safeguards, verifies resolution",
      "promptFile": "surgeon.md",
      "capabilities": {
        "canResolveImpediments": false
      }
    }
  ],
  "phases": [
    "investigating",
    "diagnosing",
    "fixing",
    "verifying"
  ],
  "flow": [
    "Describe the bug",
    "Detective investigates",
    "Root cause identified",
    "Surgeon fixes",
    "Verify fix works"
  ],
  "humanRole": "Describe symptoms, confirm root cause, verify the fix",
  "bestFor": [
    "Bug fixes",
    "Performance issues",
    "Mystery debugging"
  ]
}
