{
  "id": "test-implement",
  "name": "Test â†’ Implement",
  "tagline": "Red-Green-Refactor",
  "description": "Tests first, then implementation. The TDD way.",
  "version": "1.0.0",
  "icon": "flask",
  "active": false,
  "roles": [
    {
      "id": "test-writer",
      "name": "Test Writer",
      "role": "orchestrator",
      "description": "Writes failing tests that define expected behavior",
      "promptFile": "test-writer.md",
      "capabilities": {
        "canResolveImpediments": true
      }
    },
    {
      "id": "coder",
      "name": "Coder",
      "role": "implementer",
      "description": "Writes minimal code to make tests pass, then refactors",
      "promptFile": "coder.md",
      "capabilities": {
        "canResolveImpediments": false
      }
    }
  ],
  "phases": [
    "specifying",
    "implementing",
    "refactoring"
  ],
  "flow": [
    "Define behavior",
    "Test Writer creates tests",
    "Implementer makes them pass",
    "Refactor together",
    "Next behavior"
  ],
  "humanRole": "Define expected behaviors, verify test coverage, approve implementation",
  "bestFor": [
    "Test-driven development",
    "Bug fixes with regression tests",
    "API design"
  ]
}
